{
  "artifact_type": "requirement-coverage-record",
  "record_id": "RCR-MRQBR95N-P1R4Z3",
  "recorded_at": "2026-07-18T12:10:01.115Z",
  "work_item_id": "TASK-100",
  "work_item_ref": ".aof/tasks/done/TASK-100.json",
  "coverage_status": "completed",
  "requirements": [
    {
      "requirement_id": "V80-REQ-001",
      "title": "External runtime resource records exist",
      "requirement_type": "release_gate",
      "status": "covered",
      "source_ref": "docs/v8.0-direction-review.md",
      "owner_ref": "runtime-team",
      "acceptance_boundary": "external-runtime-resource-record writes schema-valid governed resource artifacts",
      "linked_work_item_refs": [
        ".aof/tasks/done/TASK-100.json"
      ],
      "evidence_refs": [
        "schemas/aof-external-runtime-resource-record.schema.json",
        "src/commands/external-runtime-resource-record.js",
        ".aof/artifacts/external-runtime-resources/ERR-QIF-V030.json"
      ],
      "blocker_refs": []
    },
    {
      "requirement_id": "V80-REQ-002",
      "title": "External resource use records link resources to governed work",
      "requirement_type": "release_gate",
      "status": "covered",
      "source_ref": "docs/v8.0-direction-review.md",
      "owner_ref": "runtime-team",
      "acceptance_boundary": "external-resource-use-record links task session resource operation approval outputs risks decisions and not-proven boundary",
      "linked_work_item_refs": [
        ".aof/tasks/done/TASK-100.json"
      ],
      "evidence_refs": [
        "schemas/aof-external-resource-use-record.schema.json",
        "src/commands/external-resource-use-record.js",
        ".aof/artifacts/external-resource-uses/TASK-100-QIF-V030.json"
      ],
      "blocker_refs": []
    },
    {
      "requirement_id": "V80-REQ-003",
      "title": "External resource audit gates v8 release readiness",
      "requirement_type": "release_gate",
      "status": "covered",
      "source_ref": "docs/v8.0-direction-review.md",
      "owner_ref": "verification-team",
      "acceptance_boundary": "external-resource-audit passes and release-state-audit includes it for v8.0+",
      "linked_work_item_refs": [
        ".aof/tasks/done/TASK-100.json"
      ],
      "evidence_refs": [
        "src/commands/external-resource-audit.js",
        "src/commands/release-state-audit.js",
        ".aof/artifacts/external-resources/external-resource-audit.json"
      ],
      "blocker_refs": []
    }
  ],
  "coverage_summary": {
    "total_requirements": 3,
    "covered_count": 3,
    "partial_count": 0,
    "blocked_count": 0,
    "at_risk_count": 0,
    "unstarted_count": 0
  },
  "forecast": {
    "estimated_remaining_work_items": 0,
    "estimated_token_cost_range": "complete after verification",
    "burndown_ref": null,
    "forecast_boundary": "release forecast is local governance evidence, not delivery certainty"
  },
  "not_proven": "Coverage proves v8.0 release gates are represented, not external provider execution, semantic truth, or operator acceptance.",
  "source_task_id": "TASK-100",
  "source_parent_session_id": "SESS-V80-EXTERNAL-RESOURCE-RUNTIME",
  "source_decision_record_id": "CREV-TASK-100-V80",
  "notes": null
}
